{"dataset":"sanctioned-addresses","api_version":"v1","schema_version":"1.1.0","schema_url":"https://blockchains.github.io/blockchainlab-api/v1/schemas/sanctioned-addresses.schema.json","description":"Digital currency addresses on the US Treasury OFAC SDN list, per asset. Extracted daily from the official SDN XML by github.com/0xB10C. Compliance screening aid only — verify against the official list.","generated_at":"2026-10-18T08:04:40.235Z","source":"OFAC SDN list via 0xB10C/ofac-sanctioned-digital-currency-addresses","source_url":"https://github.com/0xB10C/ofac-sanctioned-digital-currency-addresses/tree/lists","built_by":"Blockchain Lab — https://blockchainlab.com","licence_note":"Data belongs to the named source; check its terms before reuse. Attribute the source and Blockchain Lab.","count":1060,"data":[{"chain":"ETH","address":"0x0330070FD38Ec3bB94F58FA55D40368271E9e54A"},{"chain":"ETH","address":"0x038989cbb1710c72b9920dc4fa529158f463e72c"},{"chain":"ETH","address":"0x04DBA1194ee10112fE6C3207C0687DEf0e78baCf"},{"chain":"ETH","address":"0x08723392Ed15743cc38513C4925f5e6be5c17243"},{"chain":"ETH","address":"0x08b2eFdcdB8822EfE5ad0Eae55517cf5DC544251"},{"chain":"ETH","address":"0x0931cA4D13BB4ba75D9B7132AB690265D749a5E7"},{"chain":"ETH","address":"0x098B716B8Aaf21512996dC57EB0615e2383E2f96"},{"chain":"ETH","address":"0x0Ee5067b06776A89CcC7dC8Ee369984AD7Db5e06"},{"chain":"ETH","address":"0x12de548F79a50D2bd05481C8515C1eF5183666a9"},{"chain":"ETH","address":"0x14779CEC0B117d5194c750C55Ea1f42086631964"},{"chain":"ETH","address":"0x1967d8af5bd86a497fb3dd7899a020e47560daaf"},{"chain":"ETH","address":"0x1999ef52700c34de7ec2b68a28aafb37db0c5ade"},{"chain":"ETH","address":"0x19F8f2B0915Daa12a3f5C9CF01dF9E24D53794F7"},{"chain":"ETH","address":"0x19aa5fe80d33a56d56c78e82ea5e50e5d80b4dff"},{"chain":"ETH","address":"0x1CAb8177ACe78b1B6B1c393371F4f2dCAE40CbEB"},{"chain":"ETH","address":"0x1b8579cf6ab12ea6b74ac5fa41f3829a3cb61e6e"},{"chain":"ETH","address":"0x1d19b52b54e7ef5ea1a4b40b616165e798eac9f8"},{"chain":"ETH","address":"0x1da5821544e25c636c1417ba96ade4cf6d2f9b5a"},{"chain":"ETH","address":"0x21B8d56BDA776bbE68655A16895afd96F5534feD"},{"chain":"ETH","address":"0x252a8bd2319d8a555b872990601221b3a2053bce"},{"chain":"ETH","address":"0x2711d73d559f62f4f855ee21f38378f528e07985"},{"chain":"ETH","address":"0x2C7DcD774b33e10367F7d6385479e04F97d179dc"},{"chain":"ETH","address":"0x2f389ce8bd8ff92de3402ffce4691d17fc4f6535"},{"chain":"ETH","address":"0x308ed4b7b49797e1a98d3818bff6fe5385410370"},{"chain":"ETH","address":"0x32dA24Ca413F3E7B53145D4737e172C3bdF81e3e"},{"chain":"ETH","address":"0x35fB6f6DB4fb05e6A4cE86f2C93691425626d4b1"},{"chain":"ETH","address":"0x39D908dac893CBCB53Cc86e0ECc369aA4DeF1A29"},{"chain":"ETH","address":"0x3AD9dB589d201A710Ed237c829c7860Ba86510Fc"},{"chain":"ETH","address":"0x3Cffd56B47B7b41c56258D9C7731ABaDc360E073"},{"chain":"ETH","address":"0x3cbded43efdaf0fc77b9c55f6fc9988fcc9b757d"},{"chain":"ETH","address":"0x3e37627dEAA754090fBFbb8bd226c1CE66D255e9"},{"chain":"ETH","address":"0x4060cbf80734193f521a3cc6fd4e985df2825279"},{"chain":"ETH","address":"0x43fa21d92141BA9db43052492E0DeEE5aa5f0A93"},{"chain":"ETH","address":"0x48549a34ae37b12f6a30566245176994e17c6b4a"},{"chain":"ETH","address":"0x4F428c11Dc82388fa5136D636e613ad923Eb700B"},{"chain":"ETH","address":"0x4f47bc496083c727c5fbe3ce9cdf2b0f6496270c"},{"chain":"ETH","address":"0x502371699497d08D5339c870851898D6D72521Dd"},{"chain":"ETH","address":"0x530a64c0ce595026a4a556b703644228179e2d57"},{"chain":"ETH","address":"0x532b77b33a040587e9fd1800088225f99b8b0e8a"},{"chain":"ETH","address":"0x53b6936513e738f44FB50d2b9476730C0Ab3Bfc1"},{"chain":"ETH","address":"0x5512d943ed1f7c8a43f3435c85f7ab68b30121b0"},{"chain":"ETH","address":"0x56de1527136f76a809e5b14ded6103eecd072ba7"},{"chain":"ETH","address":"0x57EC89A0C056163A0314e413320f9B3ABe761259"},{"chain":"ETH","address":"0x5A14E72060c11313E38738009254a90968F58f51"},{"chain":"ETH","address":"0x5a7a51bfb49f190e5a6060a5bc6052ac14a3b59f"},{"chain":"ETH","address":"0x5d5b5dafecbf31bdb08bfd3edad4f2694372d0ef"},{"chain":"ETH","address":"0x5f48c2a71b2cc96e3f0ccae4e39318ff0dc375b2"},{"chain":"ETH","address":"0x67d40EE1A85bf4a4Bb7Ffae16De985e8427B6b45"},{"chain":"ETH","address":"0x6B0736Fed0634e15E19CC57fBA19cd179c13AbCA"},{"chain":"ETH","address":"0x6Fac4D18c912343BF86fa7049364Dd4E424Ab9C0"},{"chain":"ETH","address":"0x6b69e2a7545c166417a80c61a77562052bffa9c5"},{"chain":"ETH","address":"0x6be0ae71e6c41f2f9d0d1a3b8d0f75e6f6a0b46e"},{"chain":"ETH","address":"0x6f1ca141a28907f78ebaa64fb83a9088b02a8352"},{"chain":"ETH","address":"0x72a5843cc08275C8171E582972Aa4fDa8C397B2A"},{"chain":"ETH","address":"0x747AFB5c7A7fc34B547cD0FDEbf9b91759C5a52b"},{"chain":"ETH","address":"0x76EA76CA4Eb727f18956aB93445a94c5280412B9"},{"chain":"ETH","address":"0x797d7ae72ebddcdea2a346c1834e04d1f8df102b"},{"chain":"ETH","address":"0x7CEd75026204aC29C34bEA98905D4C949F27361e"},{"chain":"ETH","address":"0x7Db418b5D567A4e0E8c59Ad71BE1FcE48f3E6107"},{"chain":"ETH","address":"0x7F03679B56d8772530EFA516b58Bb83d4829E881"},{"chain":"ETH","address":"0x7F19720A857F834887FC9A7bC0a0fBe7Fc7f8102"},{"chain":"ETH","address":"0x7F367cC41522cE07553e823bf3be79A889DEbe1B"},{"chain":"ETH","address":"0x7FF9cFad3877F21d41Da833E2F775dB0569eE3D9"},{"chain":"ETH","address":"0x83E5bC4Ffa856BB84Bb88581f5Dd62A433A25e0D"},{"chain":"ETH","address":"0x8576acc5c05d6ce88f4e49bf65bdf0c62f91353c"},{"chain":"ETH","address":"0x8694ed130432be2cd3efff2e4d9dc52351dc7423"},{"chain":"ETH","address":"0x8Dce2aAC0dE82bdCAf6b4373B79f94331b8e4995"},{"chain":"ETH","address":"0x8ac5381FCD9e7395D14e02986c344aADA84B4bC6"},{"chain":"ETH","address":"0x8d79c73daae8630c88de372ba8f57592fa987607"},{"chain":"ETH","address":"0x901bb9583b24d97e995513c6778dc6888ab6870e"},{"chain":"ETH","address":"0x931546D9e66836AbF687d2bc64B30407bAc8C568"},{"chain":"ETH","address":"0x95584C303FCd48AF5c6B9873015f2AD0ca84EaE3"},{"chain":"ETH","address":"0x961c5be54a2ffc17cf4cb021d863c42dacd47fc1"},{"chain":"ETH","address":"0x9697749A9e8D6C119D8EEb0d6268a1b99C40684c"},{"chain":"ETH","address":"0x97b1043abd9e6fc31681635166d430a458d14f9c"},{"chain":"ETH","address":"0x983a81ca6FB1e441266D2FbcB7D8E530AC2E05A2"},{"chain":"ETH","address":"0x9Be599d7867f5E1a2D7Ec6dB9710dF2b98A15573"},{"chain":"ETH","address":"0x9DD7fA4B4950154F7e75BdD8A77266B99b94Ec08"},{"chain":"ETH","address":"0x9c2bc757b66f24d60f016b6237f8cdd414a879fa"},{"chain":"ETH","address":"0x9f4cda013e354b8fc285bf4b9a60460cee7f7ea9"},{"chain":"ETH","address":"0xA40cFBFc8534FFC84E20a7d8bBC3729B26a35F6f"},{"chain":"ETH","address":"0xD8500C631dC32FA18645B7436344a99E4825e10e"},{"chain":"ETH","address":"0xE950DC316b836e4EeFb8308bf32Bf7C72a1358FF"},{"chain":"ETH","address":"0xEFE301d259F525cA1ba74A7977b80D5b060B3ccA"},{"chain":"ETH","address":"0xF45Ecc3a59C7911181C659cE9115854c6175Be91"},{"chain":"ETH","address":"0xF7B31119c2682c88d88D455dBb9d5932c65Cf1bE"},{"chain":"ETH","address":"0xFb3eFf152ea55D1BfA04Dbdd509A80fD7b72cdEB"},{"chain":"ETH","address":"0xFda1Ec4A6178d4916b001a065422D31EBE5F62FF"},{"chain":"ETH","address":"0xa0e1c89Ef1a489c9C7dE96311eD5Ce5D32c20E4B"},{"chain":"ETH","address":"0xa7e5d5a720f06526557c513402f2e6b5fa20b008"},{"chain":"ETH","address":"0xaC4cC4B68ea24BbFAAC8fD127B67Ed445ACcCE22"},{"chain":"ETH","address":"0xb338962B92CD818D6aef0A32a9ECD01212a71f33"},{"chain":"ETH","address":"0xb5A69Da691670F62510793F79a9B36c7db1A7b7c"},{"chain":"ETH","address":"0xb637f84b66876ebf609c2a4208905f9ddac9d075"},{"chain":"ETH","address":"0xb6f5ec1a0a9cd1526536d3f0426c429529471f40"},{"chain":"ETH","address":"0xbb69e01921b17cd22080968bcc96ba6115da6062"},{"chain":"ETH","address":"0xbd3276f265b83b5e828c05f46cde9d10a1521a24"},{"chain":"ETH","address":"0xc103b7dc095c904b92081eef0c1640081ec01c10"},{"chain":"ETH","address":"0xc2a3829F459B3Edd87791c74cD45402BA0a20Be3"},{"chain":"ETH","address":"0xc455f7fd3e0e12afd51fba5c106909934d8a0e4a"},{"chain":"ETH","address":"0xcB74874f1e06Fcf80A306e06e5379A44B488bA2D"},{"chain":"ETH","address":"0xd04E33461FEA8302c5E1e13895b60cEe8AEfda7F"},{"chain":"ETH","address":"0xd0975b32cea532eadddfc9c60481976e39db3472"},{"chain":"ETH","address":"0xd5ED34b52AC4ab84d8FA8A231a3218bbF01Ed510"},{"chain":"ETH","address":"0xd81414ABc631C6CADAe1C6198b0c2b15a9B4fDe5"},{"chain":"ETH","address":"0xd882cfc20f52f2599d84b8e8d58c7fb62cfe344b"},{"chain":"ETH","address":"0xdb2720ebad55399117ddb4c4a4afd9a4ccada8fe"},{"chain":"ETH","address":"0xdcbEfFBECcE100cCE9E4b153C4e15cB885643193"},{"chain":"ETH","address":"0xe05f529f5284d75624eba386cb716928c3b54a2a"},{"chain":"ETH","address":"0xe1d865c3d669dcc8c57c8d023140cb204e672ee4"},{"chain":"ETH","address":"0xe1e4c5e5ed8f03ae61b581e2def126025f2b9401"},{"chain":"ETH","address":"0xe3d35f68383732649669aa990832e017340dbca5"},{"chain":"ETH","address":"0xe7aa314c77f4233c18c6cc84384a9247c0cf367b"},{"chain":"ETH","address":"0xeb507efa9ee692a4c774ad1de9f3cb26fc459da3"},{"chain":"ETH","address":"0xed6e0a7e4ac94d976eebfb82ccf777a3c6bad921"},{"chain":"ETH","address":"0xef85a6fafa5942a964dc618e94e230881d29ce2a"},{"chain":"ETH","address":"0xf1c4c44d2dcbcfa704349e3b57628dbd8404e597"},{"chain":"ETH","address":"0xf2235d55b2950a0b1317469d72d07ae65b2e27cb"},{"chain":"ETH","address":"0xf3701f445b6bdafedbca97d1e477357839e4120d"},{"chain":"ETH","address":"0xf4377edA661e04B6DDA78969796Ed31658D602D4"},{"chain":"XBT","address":"123WBUDmSJv4GctdVEz6Qq6z8nXSKrJ4KX"},{"chain":"XBT","address":"125W5ek3DT6Zqy5S2iPt4FHQdNMCbZA3FU"},{"chain":"XBT","address":"1295rkVyNfFpqZpXvKGhDqwhP1jZcNNDMV"},{"chain":"XBT","address":"129zKFLoVad9JtxSmDKeJoLCsjhGR7b3vr"},{"chain":"XBT","address":"12HQDsicffSBaYdJ6BhnE22sfjTESmmzKx"},{"chain":"XBT","address":"12NpCkhddSNiDkD9rRYUCHsTT9ReMNiJjG"},{"chain":"XBT","address":"12QtD5BFwRsdNsAZY76UVE1xyCGNTojH9h"},{"chain":"XBT","address":"12VrYZgS1nmf9KHHped24xBb1aLLRpV2cT"},{"chain":"XBT","address":"12YCfVAEzkEZXBYhUTyJJaRkgMXiFxJgcu"},{"chain":"XBT","address":"12YyR9EpvHxBjjKjTWqfKqeyoWnvcraxpW"},{"chain":"XBT","address":"12aNKp